"tweet_id","in_reply_to_status_id","in_reply_to_user_id","timestamp","source","text","retweeted_status_id","retweeted_status_user_id","retweeted_status_timestamp","expanded_urls"
"320211355032510464","","","2013-04-05 16:28:31 +0000","<a href=""http://www.apple.com"" rel=""nofollow"">Photos on iOS</a>","I broke the walking records this week. http://t.co/SNk1AYqQqT","","","","http://twitter.com/makzan/status/320211355032510464/photo/1"
"320125627955036160","320125153029791744","14526463","2013-04-05 10:47:52 +0000","<a href=""http://itunes.apple.com/us/app/twitter/id409789998?mt=12"" rel=""nofollow"">Twitter for Mac</a>","@thierrymichel It's a good experiment to see how context matters and how scope here not related.","","","",""
"320122281600897024","320121584356564992","14526463","2013-04-05 10:34:34 +0000","<a href=""http://itunes.apple.com/us/app/twitter/id409789998?mt=12"" rel=""nofollow"">Twitter for Mac</a>","@thierrymichel Thanks! But the greeting function is not global. I know why now, it is the context that matters. http://t.co/1M8P4AoJTf","","","","http://stackoverflow.com/a/15831546/1382695"
"320120201486155776","","","2013-04-05 10:26:18 +0000","<a href=""http://itunes.apple.com/us/app/twitter/id409789998?mt=12"" rel=""nofollow"">Twitter for Mac</a>","Found an answer on http://t.co/s6Uky3C36C, but it doesn't answer the reason. So I asked it again in SO: http://t.co/uSjS0KopLE","","","","http://stackoverflow.com/questions/3322417/javascript-losing-this-object-reference-with-private-public-properties,http://stackoverflow.com/questions/15831509/javascript-this-refers-to-window-instead-of-object-inside-function"
"320115698510741505","","","2013-04-05 10:08:24 +0000","<a href=""http://itunes.apple.com/us/app/twitter/id409789998?mt=12"" rel=""nofollow"">Twitter for Mac</a>","JS Help. Why the 'this' inside function in an object method references window scope? Thanks a lot!!

http://t.co/0gk5Q2vA7R","","","","http://jsfiddle.net/makzan/z5Zmm/"
"320113500045316096","","","2013-04-05 09:59:40 +0000","<a href=""http://itunes.apple.com/us/app/twitter/id409789998?mt=12"" rel=""nofollow"">Twitter for Mac</a>","Just realize 'this' in a function (not method) inside an object doesn't reference the object. It ref the window.","","","",""
"320096790223392769","","","2013-04-05 08:53:16 +0000","<a href=""https://dev.twitter.com/docs/tfw"" rel=""nofollow"">Twitter for Websites</a>","RT @cfaydi: One of the best product case study / story I've ever read: @teehanlax about their involvement in @medium – http://t.co/JUayY ...","319851884942876672","16980499","2013-04-04 16:40:06 +0000","http://www.teehanlax.com/story/medium?utm_source=TLtwitter&utm_medium=social&utm_campaign=TLsocial,http://www.teehanlax.com/story/medium?utm_source=TLtwitter&utm_medium=social&utm_campaign=TLsocial"
"320089112361172992","","","2013-04-05 08:22:46 +0000","<a href=""http://itunes.apple.com/us/app/twitter/id409789998?mt=12"" rel=""nofollow"">Twitter for Mac</a>","RT @ckxpress: Percy Tse Melo Chu Jon Ng Nandi Wong Wang Lau Ken Ting Kwok Lee低頭兩年做的iOS online game終於推出，希望大家多多支持 http://t.co/aG78F3fKY2","320084828861108225","14956051","2013-04-05 08:05:44 +0000","http://fb.me/2i2aiMkor,http://fb.me/2i2aiMkor"
"320039331194617857","","","2013-04-05 05:04:57 +0000","<a href=""http://itunes.apple.com/us/app/twitter/id409789998?mt=12"" rel=""nofollow"">Twitter for Mac</a>","RT @AlexOsterwalder: One of my biggest learnings the last year: The difference between reversible and irreversible decisions - make the  ...","320036138024849408","15320887","2013-04-05 04:52:15 +0000",""
"319749122963947520","","","2013-04-04 09:51:46 +0000","<a href=""http://twitter.com/download/iphone"" rel=""nofollow"">Twitter for iPhone</a>","Oops. Kindle can't share my highlighted image.","","","",""
"319748727411720192","","","2013-04-04 09:50:11 +0000","<a href=""https://kindle.amazon.com"" rel=""nofollow"">Kindle</a>","Good quotes from the book I'm reading.  http://t.co/dfR3DdCPAt","","","","http://amzn.com/k/m_UjR7FvSt6UtR-Bfs7KaQ"
"319488873161953280","","","2013-04-03 16:37:37 +0000","<a href=""http://itunes.apple.com/us/app/twitter/id409789998?mt=12"" rel=""nofollow"">Twitter for Mac</a>","RT @hlb: 一個有 bug 的瀏覽器，提供的瀏覽器切換測試工具當然也有 bug… http://t.co/GTxYjtEtFD","319456400965259264","333093","2013-04-03 14:28:35 +0000","http://blog.typekit.com/2013/03/14/the-dangers-of-cross-browser-testing-with-ie9s-browser-modes/,http://blog.typekit.com/2013/03/14/the-dangers-of-cross-browser-testing-with-ie9s-browser-modes/"
"319013817633869825","","","2013-04-02 09:09:55 +0000","<a href=""http://itunes.apple.com/us/app/twitter/id409789998?mt=12"" rel=""nofollow"">Twitter for Mac</a>","Last time I forgot to commit the changes. Today I work on the proj again and have this commit msg: ""Forgot what is this change is about.""","","","",""
"318917589600436224","","","2013-04-02 02:47:33 +0000","<a href=""http://itunes.apple.com/us/app/twitter/id409789998?mt=12"" rel=""nofollow"">Twitter for Mac</a>","Oh. Reeder Free for limited time. Using none of RSS reader in desktop. Reeder for iOS every day. May be its time to have one in my mac.","","","",""
"318605571660066816","","","2013-04-01 06:07:42 +0000","<a href=""http://www.apple.com/"" rel=""nofollow"">OS X</a>","I really like the Sweet Onion source from Subway.","","","",""
"317301314637926402","","","2013-03-28 15:45:03 +0000","<a href=""https://dev.twitter.com/docs/tfw"" rel=""nofollow"">Twitter for Websites</a>","RT @LarsLofgren: It's exceptionally easy to add complexity but very difficult to make something simple. And if you want to win, you need ...","316005784150478849","272991286","2013-03-25 01:57:04 +0000",""
"317116887945338880","","","2013-03-28 03:32:12 +0000","<a href=""http://itunes.apple.com/us/app/twitter/id409789998?mt=12"" rel=""nofollow"">Twitter for Mac</a>","Anyone using DEVONagent? I'm trying but still not sure how it searches better.","","","",""
"316931890592509952","","","2013-03-27 15:17:05 +0000","<a href=""http://itunes.apple.com/us/app/twitter/id409789998?mt=12"" rel=""nofollow"">Twitter for Mac</a>","RT @elijahmanor: Internet Explorer 11′s user-agent string: What does it mean? by @slicknet #webdev http://t.co/9xJaKz2UJU","316928035527999489","9453872","2013-03-27 15:01:46 +0000","http://manor.im/YTGZLx,http://manor.im/YTGZLx"
"316550617822818304","","","2013-03-26 14:02:03 +0000","<a href=""http://itunes.apple.com/us/app/twitter/id409789998?mt=12"" rel=""nofollow"">Twitter for Mac</a>","RT @fafner: Adding iCloud support to iOS apps is hard. This is why I put up my own shipping implementation on GitHub: https://t.co/KSk8w ...","316549999976665088","11227512","2013-03-26 13:59:35 +0000","https://github.com/IdeasOnCanvas/MNDocumentController,https://github.com/IdeasOnCanvas/MNDocumentController"
"316241728149544963","","","2013-03-25 17:34:38 +0000","<a href=""http://itunes.apple.com/us/app/twitter/id409789998?mt=12"" rel=""nofollow"">Twitter for Mac</a>","Bought a Bamboo medium 2 days ago and then tried Intuos the other night. I'm immediately regret.","","","",""
"316241358186754050","","","2013-03-25 17:33:09 +0000","<a href=""http://itunes.apple.com/us/app/twitter/id409789998?mt=12"" rel=""nofollow"">Twitter for Mac</a>","RT @oykun: Ok, finally a parallax scrolling convinced me that it can be cool! Look at this clever use with beautiful colours: http://t.c ...","316212017331589121","15306373","2013-03-25 15:36:34 +0000","http://www.andrevv.com/,http://www.andrevv.com/"
"316240922465693697","","","2013-03-25 17:31:26 +0000","<a href=""http://itunes.apple.com/us/app/twitter/id409789998?mt=12"" rel=""nofollow"">Twitter for Mac</a>","RT @oykun: White spaces in design are not wasted spaces. They clean the environment around the important element and gives better, easie ...","315770181341294592","15306373","2013-03-24 10:20:52 +0000",""
"315755053078171649","","","2013-03-24 09:20:45 +0000","<a href=""http://itunes.apple.com/us/app/twitter/id409789998?mt=12"" rel=""nofollow"">Twitter for Mac</a>","Just found out the ""Resolution Test"" extension for Google Chrome. A nice tool for responsive testing.","","","",""
"315735536302186496","","","2013-03-24 08:03:12 +0000","<a href=""http://itunes.apple.com/us/app/twitter/id409789998?mt=12"" rel=""nofollow"">Twitter for Mac</a>","I'm in WorldSkills Web Design training session again. Every sunday, in macao, the most talented web design students gathers.","","","",""
"315494096749875200","","","2013-03-23 16:03:48 +0000","<a href=""http://itunes.apple.com/us/app/twitter/id409789998?mt=12"" rel=""nofollow"">Twitter for Mac</a>","I should really lock the home button on iPad. I press on it every time I hold it.","","","",""
"315492577598140416","","","2013-03-23 15:57:46 +0000","<a href=""http://itunes.apple.com/us/app/twitter/id409789998?mt=12"" rel=""nofollow"">Twitter for Mac</a>","Why 10 years ago I didn't find out One Piece is such a fun and exciting manga / animate.","","","",""
"315036235171254272","","","2013-03-22 09:44:26 +0000","<a href=""http://itunes.apple.com/us/app/twitter/id409789998?mt=12"" rel=""nofollow"">Twitter for Mac</a>","Where is my ""+ Pocket"" bookmark. Does the latest iOS remove all bookmarklet bookmarks???","","","",""
"313891400909459456","","","2013-03-19 05:55:16 +0000","<a href=""https://dev.twitter.com/docs/tfw"" rel=""nofollow"">Twitter for Websites</a>","RT @Mike_FTW: Good design is not a reflection of the designer’s effort. In fact, the best design looks like it took no time at all.","313671122551967744","2426","2013-03-18 15:19:58 +0000",""
"309646191673610240","","","2013-03-07 12:46:19 +0000","<a href=""http://www.tumblr.com/"" rel=""nofollow"">Tumblr</a>","Photo: Another sea sight in Hong Kong. http://t.co/GmJcOItdih","","","","http://tmblr.co/ZBkANyfj8LR-"
"309268228947980289","","","2013-03-06 11:44:26 +0000","<a href=""http://itunes.apple.com/us/app/twitter/id409789998?mt=12"" rel=""nofollow"">Twitter for Mac</a>","Or this is a signal that I do not have enough exercise. So I'm going to do more after works.","","","",""
"309268128452444161","","","2013-03-06 11:44:02 +0000","<a href=""http://itunes.apple.com/us/app/twitter/id409789998?mt=12"" rel=""nofollow"">Twitter for Mac</a>","I got sick for several times within a short period, during the season changing. Spring seems to be a low productivity season for me.","","","",""
"307494777845338112","","","2013-03-01 14:17:22 +0000","<a href=""http://itunes.apple.com/us/app/twitter/id409789998?mt=12"" rel=""nofollow"">Twitter for Mac</a>","Real Racing 3 Deleted.","","","",""
"307042974041255936","","","2013-02-28 08:22:04 +0000","<a href=""http://www.tumblr.com/"" rel=""nofollow"">Tumblr</a>","Book review on Learning Modernizr. http://t.co/1Y1bdsbQfw","","","","http://tmblr.co/ZBkANyfB0rAT"
"305604806846840832","","","2013-02-24 09:07:18 +0000","<a href=""http://www.tumblr.com/"" rel=""nofollow"">Tumblr</a>","Photo: WorldSkills training time. http://t.co/wXilwu3S4D","","","","http://tmblr.co/ZBkANyetUFmS"
"304415930816012288","","","2013-02-21 02:23:08 +0000","<a href=""http://www.tumblr.com/"" rel=""nofollow"">Tumblr</a>","Photo: My next book reading: Learning Modernizr. I think I’m going to write a short book review on each book... http://t.co/SlFipLQKBB","","","","http://tmblr.co/ZBkANyedXoYK"
"303541311364022272","","","2013-02-18 16:27:42 +0000","<a href=""http://itunes.apple.com/us/app/twitter/id409789998?mt=12"" rel=""nofollow"">Twitter for Mac</a>","RT @the_42games: Going to launch a new website with lots of CSS effects that you can pick and use in your next web project.... http://t. ...","303541246717214720","228761165","2013-02-18 16:27:27 +0000","http://fb.me/2MNrfk5pa,http://fb.me/2MNrfk5pa"
"303511956994789377","","","2013-02-18 14:31:04 +0000","<a href=""http://www.tumblr.com/"" rel=""nofollow"">Tumblr</a>","Photo: My next reading. http://t.co/ha45nyRL","","","","http://tmblr.co/ZBkANyeQojc2"
"303509876640980992","","","2013-02-18 14:22:48 +0000","<a href=""http://www.tumblr.com/"" rel=""nofollow"">Tumblr</a>","Photo: Just pre-ordered the future 3 Offscreen issues. And here is all existing ones. http://t.co/Q0R5wTxz","","","","http://tmblr.co/ZBkANyeQnM_5"
"303495726665695232","","","2013-02-18 13:26:34 +0000","<a href=""http://itunes.apple.com/us/app/twitter/id409789998?mt=12"" rel=""nofollow"">Twitter for Mac</a>","I remember there is a mac app to toggle between application shortcuts or global ones. Forgot the name. Any one has clue on it? Thanks!","","","",""
"302448148423507968","","","2013-02-15 16:03:52 +0000","<a href=""http://www.apple.com/"" rel=""nofollow"">OS X</a>","Back to work from my Chinese New Year holiday!","","","",""
"302380445855805440","","","2013-02-15 11:34:50 +0000","<a href=""http://www.tumblr.com/"" rel=""nofollow"">Tumblr</a>","Photo: I’m going to alternatively use black and red color. http://t.co/d3Qobr0F","","","","http://tmblr.co/ZBkANyeBUiCy"
"302221802455842816","","","2013-02-15 01:04:27 +0000","<a href=""http://itunes.apple.com/us/app/read-it-later-pro/id309601447?mt=8&uo=4"" rel=""nofollow"">Pocket for iOS</a>","Interesting discussion on whether ""your stuff"" or ""my stuff"" makes more sense. Yours vs. Mine (via @Pocket) http://t.co/ixa46eN9","","","","http://pocket.co/swgfp"
"302006471946821632","","","2013-02-14 10:48:48 +0000","<a href=""https://dev.twitter.com/docs/tfw"" rel=""nofollow"">Twitter for Websites</a>","Wow! One year of Treehouse's Gold Plan for $49 http://t.co/aBzUAgRB via @appsumo","","","","http://www.appsumo.com/~Pz2pb/"
"301682193804185600","","","2013-02-13 13:20:14 +0000","<a href=""http://www.tumblr.com/"" rel=""nofollow"">Tumblr</a>","Photo: Looks like my sister has a talent on doodling. http://t.co/OyyJBBPy","","","","http://tmblr.co/ZBkANye2yWgx"
"301608089474441216","","","2013-02-13 08:25:46 +0000","<a href=""http://www.apple.com/"" rel=""nofollow"">OS X</a>","4 more pages drawing and I will get my 1st moleskine full. My 2nd one would be sketchbook for 2/14 gift for my gf. then start my 3rd one.","","","",""
"301259319020777472","","","2013-02-12 09:19:53 +0000","<a href=""http://www.tumblr.com/"" rel=""nofollow"">Tumblr</a>","Photo: My sister is drawing on a sketch book that I’m drawing for my girlfriend’s gift. Shuuu. Don’t let my... http://t.co/jTwgjAf1","","","","http://tmblr.co/ZBkANydzyy3l"
"301246383522992128","","","2013-02-12 08:28:29 +0000","<a href=""http://www.apple.com"" rel=""nofollow"">iOS</a>","Playing with Mailbox app.","","","",""
"301214385504915456","","","2013-02-12 06:21:20 +0000","<a href=""http://www.apple.com"" rel=""nofollow"">iOS</a>","I pressed the #mailbox logo for two seconds and can re-enter the code that I reserved long time ago. Now I have access to the app.","","","",""
"300605928795959296","","624947324","2013-02-10 14:03:33 +0000","<a href=""http://tapbots.com/tweetbot"" rel=""nofollow"">Tweetbot for iOS</a>","@mailbox I remembered my reserve code after tapped the new reserve button in my iPhone. How I can re-enter the reserved code now?","","","",""
"300605303316172800","","","2013-02-10 14:01:03 +0000","<a href=""http://www.apple.com"" rel=""nofollow"">iOS</a>","Yes. I did reserved my Mailbox App long time ago.","","","",""
"300275460783366145","","","2013-02-09 16:10:23 +0000","<a href=""http://vine.co"" rel=""nofollow"">Vine - Make a Scene</a>","Macao temple during first day of Chinese New Year. http://t.co/kEV95xe2","","","","http://vine.co/v/bvWrHeAPTjL"
"300274971597500417","","","2013-02-09 16:08:26 +0000","<a href=""http://vine.co"" rel=""nofollow"">Vine - Make a Scene</a>","炮竹一聲除舊歲 http://t.co/8028RzeU","","","","http://vine.co/v/bvWvQLgPA9l"
"300274122221568000","","","2013-02-09 16:05:04 +0000","<a href=""http://vine.co"" rel=""nofollow"">Vine - Make a Scene</a>","A-ma temple at Macao http://t.co/m48btZHF","","","","http://vine.co/v/bvWnYpFPzb0"
"300273802250702848","","","2013-02-09 16:03:47 +0000","<a href=""http://vine.co"" rel=""nofollow"">Vine - Make a Scene</a>","Temple during the Chinese New Year http://t.co/ADVYV7ds","","","","http://vine.co/v/bvWnW69Tx2F"
"300273216658763776","","","2013-02-09 16:01:28 +0000","<a href=""http://www.tumblr.com/"" rel=""nofollow"">Tumblr</a>","Photo: A-ma Temple http://t.co/Fz9aRNne","","","","http://tmblr.co/ZBkANydlKCZW"
"300163224446328832","","","2013-02-09 08:44:24 +0000","<a href=""http://www.tumblr.com/"" rel=""nofollow"">Tumblr</a>","Photo: Received my first wedding gift. http://t.co/d1NmrJhW","","","","http://tmblr.co/ZBkANydkK2Wr"
"297200393581109248","","","2013-02-01 04:31:10 +0000","<a href=""http://vine.co"" rel=""nofollow"">Vine - Make a Scene</a>","You were not fish. How you can know the fish enjoys the swim? http://t.co/5RF71lBv","","","","http://vine.co/v/b1AYHuThuLn"
"296533518966743040","","","2013-01-30 08:21:14 +0000","<a href=""http://vine.co"" rel=""nofollow"">Vine - Make a Scene</a>","Hot tea with smoke. Calm and peaceful. http://t.co/TfyTzwBP","","","","http://vine.co/v/bJxEhYdjBAx"
"295776044810653696","","","2013-01-28 06:11:18 +0000","<a href=""http://www.tumblr.com/"" rel=""nofollow"">Tumblr</a>","Photo: The wedding invitation card. Simulated by my ink jet printer. http://t.co/6rTrqd3r","","","","http://tmblr.co/ZBkANycqY4Oo"
"295528999768190977","","","2013-01-27 13:49:38 +0000","<a href=""http://vine.co"" rel=""nofollow"">Vine - Make a Scene</a>","I'm full. Can't eat them all. http://t.co/JslVLErU","","","","http://vine.co/v/bJKjiiVK6Qq"
"295459102883201024","","","2013-01-27 09:11:54 +0000","<a href=""http://vine.co"" rel=""nofollow"">Vine - Make a Scene</a>","New generation's busy things. http://t.co/e8gbCbCW","","","","http://vine.co/v/bJZHWYapUTp"
"295429803702624256","","","2013-01-27 07:15:28 +0000","<a href=""http://itunes.apple.com/us/app/twitter/id409789998?mt=12"" rel=""nofollow"">Twitter for Mac</a>","RT @the_42games: Chinese description for the General Assembly Programming for Non-Programming workshop coming this Saturday in… http://t ...","295429745439567873","228761165","2013-01-27 07:15:14 +0000","http://tmblr.co/ZomZZvcl5wNa,http://tmblr.co/ZomZZvcl5wNa"
"295172374565883904","","","2013-01-26 14:12:32 +0000","<a href=""http://vine.co"" rel=""nofollow"">Vine - Make a Scene</a>","Waiting upload is a pain. Luckily I can shorten it into 6 seconds here. http://t.co/mM8QMz0f","","","","http://vine.co/v/b53VgeZp3A0"
"294732168545058816","","","2013-01-25 09:03:19 +0000","<a href=""http://vine.co"" rel=""nofollow"">Vine - Make a Scene</a>","Walking in texture. http://t.co/AARyrcaz","","","","http://vine.co/v/b5TInpwazBt"
"294728393541443584","","","2013-01-25 08:48:19 +0000","<a href=""http://vine.co"" rel=""nofollow"">Vine - Make a Scene</a>","Yummy. http://t.co/G4q6J2v7","","","","http://vine.co/v/b5TH09xn5tK"
"294715209531154433","","","2013-01-25 07:55:56 +0000","<a href=""http://vine.co"" rel=""nofollow"">Vine - Make a Scene</a>","Decorating the Rush HTML5 game, fast forwarded in 6 seconds. http://t.co/1nhmxcKo","","","","http://vine.co/v/b5TmniWHp9t"
"294709682495434752","","","2013-01-25 07:33:58 +0000","<a href=""http://vine.co"" rel=""nofollow"">Vine - Make a Scene</a>","My #firstpost on Vine. http://t.co/myvMGEQI","","","","http://vine.co/v/b5IlZzaQxAF"
"294445125789175809","","10079052","2013-01-24 14:02:43 +0000","<a href=""http://itunes.apple.com/us/app/twitter/id409789998?mt=12"" rel=""nofollow"">Twitter for Mac</a>","@rjs Im using your UI flow approach. got 1 question. How do you express action that isn’t triggered by user? such as a timeout after 3 mins.","","","",""
"294091772907376640","","","2013-01-23 14:38:37 +0000","<a href=""http://www.tumblr.com/"" rel=""nofollow"">Tumblr</a>","Photo: Nice view in Hong Kong harbour. http://t.co/ANIxpwn5","","","","http://tmblr.co/ZBkANycSN3Py"
"292514043095302144","","","2013-01-19 06:09:17 +0000","<a href=""http://www.tumblr.com/"" rel=""nofollow"">Tumblr</a>","Photo: I feel peaceful here. http://t.co/mo6rxWd6","","","","http://tmblr.co/ZBkANyc68H7W"
"292513082738098176","","","2013-01-19 06:05:28 +0000","<a href=""http://www.tumblr.com/"" rel=""nofollow"">Tumblr</a>","Photo: We lack of silent places when living in city. http://t.co/mjcJ50mQ","","","","http://tmblr.co/ZBkANyc67Sjf"
"292107942784811010","292090672079585280","137680196","2013-01-18 03:15:35 +0000","<a href=""http://itunes.apple.com/us/app/twitter/id409789998?mt=12"" rel=""nofollow"">Twitter for Mac</a>","@kingzoggy Hi, Followed.","","","",""
"292088074471624704","","","2013-01-18 01:56:38 +0000","<a href=""http://itunes.apple.com/us/app/twitter/id409789998?mt=12"" rel=""nofollow"">Twitter for Mac</a>","I will be the special responsibility on the web design layout module in the coming WorldSkills competition in German this July.","","","",""
"290991554066280448","","","2013-01-15 01:19:27 +0000","<a href=""http://www.tumblr.com/"" rel=""nofollow"">Tumblr</a>","Photo: The symbolic floor texture in Macao http://t.co/bnrNft0W","","","","http://tmblr.co/ZBkANybnjbGG"
"290838335574925312","","","2013-01-14 15:10:37 +0000","<a href=""http://itunes.apple.com/us/app/twitter/id409789998?mt=12"" rel=""nofollow"">Twitter for Mac</a>","RT @the_42games: Zoë from the CreateJS suite is very useful for exporting the animation from Flash to SpriteSheet. And we cove… http://t ...","290837788163731457","228761165","2013-01-14 15:08:26 +0000","http://tmblr.co/ZomZZvblCYTk,http://tmblr.co/ZomZZvblCYTk"
"290821872826859520","","","2013-01-14 14:05:12 +0000","<a href=""http://www.tumblr.com/"" rel=""nofollow"">Tumblr</a>","Photo: Beautiful Night in Macao. http://t.co/IAb6XIAP","","","","http://tmblr.co/ZBkANybl2vua"
"289719583311544320","","","2013-01-11 13:05:06 +0000","<a href=""http://itunes.apple.com/us/app/twitter/id409789998?mt=12"" rel=""nofollow"">Twitter for Mac</a>","http://t.co/lWNSUxWq is really a simple yet useful website. It changes my habit on writing.","","","","http://750words.com"
"289313854079512576","","","2013-01-10 10:12:52 +0000","<a href=""http://www.tumblr.com/"" rel=""nofollow"">Tumblr</a>","Photo: Using (paper) google map on my Mac. http://t.co/Nu2rGa8e","","","","http://tmblr.co/ZBkANybQ990U"
"288494429382262785","","","2013-01-08 03:56:46 +0000","<a href=""http://www.tumblr.com/"" rel=""nofollow"">Tumblr</a>","Workshop: Programming for Non-Programmers We are hosting a workshop, partnership with General Assembly on web… http://t.co/GsYDHdwh","","","","http://tmblr.co/ZBkANybFQTM2"
"288204685314236417","288179549441757184","8106382","2013-01-07 08:45:26 +0000","<a href=""http://itunes.apple.com/us/app/twitter/id409789998?mt=12"" rel=""nofollow"">Twitter for Mac</a>","@lemankwok http://t.co/7N2uwbqt","","","","http://www.adobe.com/cfusion/entitlement/index.cfm?e=cs2%5Fdownloads&pid=4485850"
"288163920496181249","","","2013-01-07 06:03:27 +0000","<a href=""http://www.apple.com/"" rel=""nofollow"">OS X</a>","Oh~ Adobe CS2 softwares now officially free for download and use.","","","",""
"287894864681639936","","","2013-01-06 12:14:19 +0000","<a href=""http://www.apple.com"" rel=""nofollow"">Photos on iOS</a>","Traditional Portuguese Dinner at New Camões Restaurant. http://t.co/UUlQwOtj","","","","http://twitter.com/makzan/status/287894864681639936/photo/1"
"286644582379311104","","","2013-01-03 01:26:08 +0000","<a href=""http://www.apple.com/"" rel=""nofollow"">OS X</a>","Cannot load the font and read any text at all in the Ubuntu phone website.","","","",""
"286524950775488512","","","2013-01-02 17:30:46 +0000","<a href=""http://itunes.apple.com/us/app/twitter/id409789998?mt=12"" rel=""nofollow"">Twitter for Mac</a>","RT @the_42games: A screenshot of editing the HTML5 games dev screencast. All recordings are finished and now fine tuning them. http://t. ...","286524471882420224","228761165","2013-01-02 17:28:52 +0000","http://tmblr.co/ZomZZvanPTWB,http://tmblr.co/ZomZZvanPTWB"
"286413813945884672","","","2013-01-02 10:09:09 +0000","<a href=""http://www.apple.com"" rel=""nofollow"">iOS</a>","This morning when I want to write 2013. I didn't write 2012. I wrote 2003.","","","",""
"285351071688318976","","","2012-12-30 11:46:11 +0000","<a href=""http://www.apple.com/"" rel=""nofollow"">OS X</a>","Skitch for Mac becomes worse and worse after acquired by Evernote.","","","",""
"285333656086659072","","","2012-12-30 10:36:59 +0000","<a href=""http://www.apple.com"" rel=""nofollow"">iOS</a>","Oh! Need to pay for the layer feature in new Brushes app. I just want a 4"" screen support for my original Brushes app. @brushesapp","","","",""
"285332608567615490","","","2012-12-30 10:32:49 +0000","<a href=""http://www.apple.com"" rel=""nofollow"">iOS</a>","Just know that Brushes for iOS is upgraded to ver. 3 as a new app. I was still using the original Brushes app in last minute.","","","",""
"285288495025618946","","","2012-12-30 07:37:32 +0000","<a href=""http://www.apple.com/"" rel=""nofollow"">OS X</a>","Don't like this youtube radius button placed within a sharp corner box. They don't match at all. http://t.co/ywSibNvA","","","","http://twitter.com/makzan/status/285288495025618946/photo/1"
"284943927688167424","","","2012-12-29 08:48:21 +0000","<a href=""https://dev.twitter.com/docs/tfw"" rel=""nofollow"">Twitter for Websites</a>","Added to Wish List: 'Refactoring: Improving the Design of Existing Code' by Martin Fowler via @amazon","","","",""
"284447440952766464","","","2012-12-27 23:55:29 +0000","<a href=""http://www.apple.com"" rel=""nofollow"">iOS</a>","A nightmare that cannot catch the flight to Germany WorldSkills.","","","",""
"284302223419260929","","","2012-12-27 14:18:27 +0000","<a href=""http://www.apple.com"" rel=""nofollow"">Photos on iOS</a>","Nice chat with friends in Hong Kong, Sai Kung. http://t.co/9gCIAl6d","","","","http://twitter.com/makzan/status/284302223419260929/photo/1"
