"tweet_id","in_reply_to_status_id","in_reply_to_user_id","timestamp","source","text","retweeted_status_id","retweeted_status_user_id","retweeted_status_timestamp","expanded_urls"
"484916828125163520","","","2014-07-04 04:29:15 +0000","<a href=""https://about.twitter.com/products/tweetdeck"" rel=""nofollow"">TweetDeck</a>","Nitrous.io + Cloud 66 + DigitalOcean = Rails development and deployment without all the mess.","","","",""
"484610246204092416","","","2014-07-03 08:11:00 +0000","<a href=""https://about.twitter.com/products/tweetdeck"" rel=""nofollow"">TweetDeck</a>","Renewed my Evernote subscription. Has been premium for 4 years.","","","",""
"484553451448172545","","","2014-07-03 04:25:20 +0000","<a href=""https://about.twitter.com/products/tweetdeck"" rel=""nofollow"">TweetDeck</a>","Got my first client project for HTML5 game. Will use CreateJS.","","","",""
"484527204836327425","","","2014-07-03 02:41:02 +0000","<a href=""http://www.tumblr.com/"" rel=""nofollow"">Tumblr</a>","Photo: A very useful 3D printed stand on my desk. http://t.co/CcUF0SaxsA","","","","http://tmblr.co/ZBkANy1KPE9TA"
"484504973204791296","","","2014-07-03 01:12:41 +0000","<a href=""http://www.tumblr.com/"" rel=""nofollow"">Tumblr</a>","Photo: Can’t believe I’m writing in a task management tool. And it works. Love the flexibility of @asana. http://t.co/lL3MwWa118","","","","http://tmblr.co/ZBkANy1KOo2Gz"
"484504474786856962","","","2014-07-03 01:10:43 +0000","<a href=""https://about.twitter.com/products/tweetdeck"" rel=""nofollow"">TweetDeck</a>","asana saved my typed comments before I click the comment button. Like it.","","","",""
"484270895641264128","","","2014-07-02 09:42:33 +0000","<a href=""https://about.twitter.com/products/tweetdeck"" rel=""nofollow"">TweetDeck</a>","Once upon a time, I setup my home working environment like this. http://t.co/R7tgG9UmMK","","","","http://twitter.com/makzan/status/484270895641264128/photo/1"
"484257006216179713","484255773888102400","784554709","2014-07-02 08:47:22 +0000","<a href=""https://about.twitter.com/products/tweetdeck"" rel=""nofollow"">TweetDeck</a>","@JoshDeax This one sounds good. But all I need is a tasks management tool rather than a company social network.","","","",""
"484253747292303361","484253533730914304","271599461","2014-07-02 08:34:25 +0000","<a href=""https://about.twitter.com/products/tweetdeck"" rel=""nofollow"">TweetDeck</a>","@ngsiolei Add it to wish list? Actually Austin’s book is always short. Just force yourself to finish it in one weekend.","","","",""
"484243772725665793","","","2014-07-02 07:54:46 +0000","<a href=""https://about.twitter.com/products/tweetdeck"" rel=""nofollow"">TweetDeck</a>","Just bought the book Show Your Work Eng edition while reading the Korean edition at  the same time. http://t.co/f8ysmrFCZq","","","","http://austinkleon.com/show-your-work/"
"484225429536907264","","","2014-07-02 06:41:53 +0000","<a href=""https://about.twitter.com/products/tweetdeck"" rel=""nofollow"">TweetDeck</a>","My new book is uploaded to Amazon. Very soon it will be available. Of course you may pre-order it now. http://t.co/V3vf5nCfVn","","","","http://www.packtpub.com/html5-game-development-hotshot/book"
"484199118168813568","","","2014-07-02 04:57:20 +0000","<a href=""https://about.twitter.com/products/tweetdeck"" rel=""nofollow"">TweetDeck</a>","A quick reminder, PacktPub’s $10 promotion for all books and videos will end in 4 days. http://t.co/MT4kpGBCme","","","","http://bit.ly/1q8vtgN"
"484173035453173760","484172710591729664","202886242","2014-07-02 03:13:41 +0000","<a href=""https://about.twitter.com/products/tweetdeck"" rel=""nofollow"">TweetDeck</a>","@asana I see. Thanks ;-)","","","",""
"484171903095930880","","","2014-07-02 03:09:11 +0000","<a href=""http://twitter.com/download/iphone"" rel=""nofollow"">Twitter for iPhone</a>","Had used asana, Basecamp, things, Omnifocus. Now switching to Asana again to see if it fits my current workflow.","","","",""
"484171523716956160","484171317734670336","202886242","2014-07-02 03:07:41 +0000","<a href=""http://twitter.com/download/iphone"" rel=""nofollow"">Twitter for iPhone</a>","@asana yep. Just wondering why it's different from other workspaces.","","","",""
"484142023587282944","","","2014-07-02 01:10:28 +0000","<a href=""https://about.twitter.com/products/tweetdeck"" rel=""nofollow"">TweetDeck</a>","I’m wondering why @asana don’t allow reordering projects in personal projects.","","","",""
"484136273846611969","484126324512944128","202886242","2014-07-02 00:47:37 +0000","<a href=""http://twitter.com/download/iphone"" rel=""nofollow"">Twitter for iPhone</a>","@asana okay. Thanks for noting the request.","","","",""
"484119250680819713","484017704064409600","202886242","2014-07-01 23:39:58 +0000","<a href=""http://twitter.com/download/iphone"" rel=""nofollow"">Twitter for iPhone</a>","@asana Thanks. Is there any way I can select comment text in mobile view? This is important in my daily workflow.","","","",""
"483973912603029505","","","2014-07-01 14:02:27 +0000","<a href=""http://twitter.com/download/iphone"" rel=""nofollow"">Twitter for iPhone</a>","In some cases, asana is more like a list outline tool. I like this flexibility. But I really don't like its mobile edition.","","","",""
"483965044296663040","","","2014-07-01 13:27:12 +0000","<a href=""http://twitter.com/download/iphone"" rel=""nofollow"">Twitter for iPhone</a>","Can't select comment text in asana mobile view. Can't even find support email because the http://t.co/tAr3xgwA5J forces redirection.","","","","http://asana.com"
"483901378180288512","","202886242","2014-07-01 09:14:13 +0000","<a href=""https://about.twitter.com/products/tweetdeck"" rel=""nofollow"">TweetDeck</a>","@asana Is there any way to add tasks before deciding which workgroup to place? I used to add task before thinking where it belongs.","","","",""
"483805811701862400","","","2014-07-01 02:54:28 +0000","<a href=""https://about.twitter.com/products/tweetdeck"" rel=""nofollow"">TweetDeck</a>","Tried Asana several years ago. Now giving it a second try. I had used Things, Basecamp. Now using OmniFocus.","","","",""
"483761745937195008","","","2014-06-30 23:59:22 +0000","<a href=""http://twitter.com/download/iphone"" rel=""nofollow"">Twitter for iPhone</a>","My .net collection before I moved to digital subscription. http://t.co/k4p4ffVGz8","","","","http://twitter.com/makzan/status/483761745937195008/photo/1"
"483447411029733376","","","2014-06-30 03:10:19 +0000","<a href=""http://twitter.com/download/iphone"" rel=""nofollow"">Twitter for iPhone</a>","Just curious. When will Dropbox drops prices?","","","",""
"483441157457068032","","","2014-06-30 02:45:28 +0000","<a href=""http://www.tumblr.com/"" rel=""nofollow"">Tumblr</a>","Photo: Writing mode: ON. http://t.co/TXhG6ziKjv","","","","http://tmblr.co/ZBkANy1K74JAx"
"483123601076649984","","","2014-06-29 05:43:37 +0000","<a href=""http://www.tumblr.com/"" rel=""nofollow"">Tumblr</a>","Photo: It’s 3D printing era. http://t.co/WaZ62ruBZt","","","","http://tmblr.co/ZBkANy1K1vt8o"
"482915151767928832","","","2014-06-28 15:55:18 +0000","<a href=""http://www.tumblr.com/"" rel=""nofollow"">Tumblr</a>","Photo: It’s because you can fold the sketchsheet and feel touching your mobile web sketch. http://t.co/r1OmxFk6TV","","","","http://tmblr.co/ZBkANy1J_ACRN"
"482914784946692096","","","2014-06-28 15:53:51 +0000","<a href=""http://www.tumblr.com/"" rel=""nofollow"">Tumblr</a>","Photo: Why I like sketching website idea in Zurb Responsive Sketchsheet? http://t.co/mIBlySn6jd","","","","http://tmblr.co/ZBkANy1J_9qFj"
"482839936723591168","","","2014-06-28 10:56:26 +0000","<a href=""http://www.tumblr.com/"" rel=""nofollow"">Tumblr</a>","Photo: Taking rest after the web design course. http://t.co/UYTS24nUBn","","","","http://tmblr.co/ZBkANy1JzCAI4"
"482771301367427072","","","2014-06-28 06:23:42 +0000","<a href=""http://twitter.com/download/iphone"" rel=""nofollow"">Twitter for iPhone</a>","Another week for the web design course — responsive web. Targeting IT teachers in a high school in Macao.  http://t.co/bQyS2cYeOR","","","","http://makzan.net/introducing-web-design/chapter-5/"
"482716135347867648","","","2014-06-28 02:44:29 +0000","<a href=""http://www.apple.com"" rel=""nofollow"">iOS</a>","“Interaction design is not about finding the perfect design, it’s finding the best compromise.” http://t.co/GvWuMotgil","","","","http://pocket.co/sNVMy"
"482522816043298816","","","2014-06-27 13:56:18 +0000","<a href=""http://www.tumblr.com/"" rel=""nofollow"">Tumblr</a>","Photo: 疊疊樂 stack of MacBooks in my home. http://t.co/i4M0IpzCqF","","","","http://tmblr.co/ZBkANy1Jt-_VM"
"482509305011138560","","","2014-06-27 13:02:37 +0000","<a href=""https://about.twitter.com/products/tweetdeck"" rel=""nofollow"">TweetDeck</a>","Can’t Agree more! RT @thetechblock: Google's new smartwatches do too much, by @stevekovach http://t.co/R7hmh1Rbmc","","","","http://buff.ly/1iBs7lV"
"482503648446926848","","","2014-06-27 12:40:08 +0000","<a href=""http://twitter.com/download/iphone"" rel=""nofollow"">Twitter for iPhone</a>","Added zoom in/out to images on my tutorials. Designed to be scroll friendly and minimal—both code and visually. http://t.co/xbttqOdOQR","","","","http://makzan.net/introducing-web-design/chapter-3/"
"482411367735898112","","","2014-06-27 06:33:27 +0000","<a href=""https://about.twitter.com/products/tweetdeck"" rel=""nofollow"">TweetDeck</a>","My new book HTML5 Game Dev Hotshot is ready soon. $10 for 8 game tutorials and source codes. 10 days only. http://t.co/V3vf5nCfVn","","","","http://www.packtpub.com/html5-game-development-hotshot/book"
"482000947451682816","481998881199104000","41737683","2014-06-26 03:22:35 +0000","<a href=""https://about.twitter.com/products/tweetdeck"" rel=""nofollow"">TweetDeck</a>","@johnyau @siuying Things is not trustworthy anymore when it’s promoted as “unlimited”.","","","",""
"481999236985155586","","","2014-06-26 03:15:47 +0000","<a href=""https://about.twitter.com/products/tweetdeck"" rel=""nofollow"">TweetDeck</a>","RT @AwkwardGoogle: Now that's deep! http://t.co/XYOKLrEbyT","474536123080134656","476199422","2014-06-05 13:00:02 +0000","http://twitter.com/AwkwardGoogle/status/474536123080134656/photo/1,http://twitter.com/AwkwardGoogle/status/474536123080134656/photo/1"
"481994224854769664","","","2014-06-26 02:55:52 +0000","<a href=""https://about.twitter.com/products/tweetdeck"" rel=""nofollow"">TweetDeck</a>","RT @kelvw: Github - Atom Shell: Technical differences to Node-Webkit https://t.co/m7dq1TCkej","481992235550928896","96323946","2014-06-26 02:47:58 +0000","https://github.com/atom/atom-shell/blob/master/docs/development/atom-shell-vs-node-webkit.md,https://github.com/atom/atom-shell/blob/master/docs/development/atom-shell-vs-node-webkit.md"
"481989849398775808","","","2014-06-26 02:38:29 +0000","<a href=""https://about.twitter.com/products/tweetdeck"" rel=""nofollow"">TweetDeck</a>","Guess what's next after OneDrive prompts the path-too-long error? It starts over as if I have never used it. Configuring everything again.","","","",""
"481982344765513728","481982030792515584","2017551","2014-06-26 02:08:40 +0000","<a href=""https://about.twitter.com/products/tweetdeck"" rel=""nofollow"">TweetDeck</a>","@siuying I was thinking to replace the expensive Dropbox (paying $200/yr) with OneDrive. Now this is a deal breaker.","","","",""
"481974556790239232","","","2014-06-26 01:37:43 +0000","<a href=""https://about.twitter.com/products/tweetdeck"" rel=""nofollow"">TweetDeck</a>","Giving OneDrive a try. It failed to sync files that path is longer than 256 chars. Are you serious Microsoft? http://t.co/DXPqxFN0Vw","","","","http://twitter.com/makzan/status/481974556790239232/photo/1"
"481846662566920193","","","2014-06-25 17:09:31 +0000","<a href=""https://about.twitter.com/products/tweetdeck"" rel=""nofollow"">TweetDeck</a>","RT @sethclifford: First draft Google design doc. New one’s better.

OH CALM DOWN, IT’S JUST A JOKE http://t.co/r8RnNBQB4r","481843849799929856","17530043","2014-06-25 16:58:20 +0000","http://twitter.com/sethclifford/status/481843849799929856/photo/1,http://twitter.com/sethclifford/status/481843849799929856/photo/1"
"481773741852999682","","","2014-06-25 12:19:45 +0000","<a href=""https://about.twitter.com/products/tweetdeck"" rel=""nofollow"">TweetDeck</a>","I’ve done checking all the chapters. Now just wait for the final files upload and my book will be ready for sale. http://t.co/V3vf5nCfVn","","","","http://www.packtpub.com/html5-game-development-hotshot/book"
"481584071089201153","","","2014-06-24 23:46:04 +0000","<a href=""http://twitter.com/download/iphone"" rel=""nofollow"">Twitter for iPhone</a>","RT @chriscoyier: I wrote a thing (for beginners) to explain how the different bits of web technology fit together :: http://t.co/IKPdSgFzIe…","481567966970933249","793830","2014-06-24 22:42:05 +0000","http://css-tricks.com/web-technologies-hanging-together/,http://css-tricks.com/web-technologies-hanging-together/"
"481358505144631296","","","2014-06-24 08:49:45 +0000","<a href=""https://about.twitter.com/products/tweetdeck"" rel=""nofollow"">TweetDeck</a>","RT @AsherVo: Ooh weird still got a super old version of threes on this old ipad http://t.co/bY2QmcrONa","481349844812849152","16741826","2014-06-24 08:15:20 +0000","http://twitter.com/AsherVo/status/481349844812849152/photo/1,http://twitter.com/AsherVo/status/481349844812849152/photo/1"
"481358190001393664","","","2014-06-24 08:48:30 +0000","<a href=""https://about.twitter.com/products/tweetdeck"" rel=""nofollow"">TweetDeck</a>","RT @iA: Safari &gt; Preferences &gt; Uncheck the ""Allow websites to ask for permission to send push notifications"" http://t.co/VmO0X2C52w","481351597906485248","2087371","2014-06-24 08:22:18 +0000","http://twitter.com/iA/status/481351597906485248/photo/1,http://twitter.com/iA/status/481351597906485248/photo/1"
"480998027172544512","","","2014-06-23 08:57:20 +0000","<a href=""http://www.tumblr.com/"" rel=""nofollow"">Tumblr</a>","Photo: The 5000 faces of makzan. http://t.co/h4XPGLyZmh","","","","http://tmblr.co/ZBkANy1JV2V1z"
"480997032648142848","","","2014-06-23 08:53:23 +0000","<a href=""http://twitter.com/download/iphone"" rel=""nofollow"">Twitter for iPhone</a>","Playing the 3D scanning digitalizer. It's quite useless actually. Can't scan most of materials and colors. http://t.co/AdOOKVB48U","","","","http://twitter.com/makzan/status/480997032648142848/photo/1"
"480554214683205633","","","2014-06-22 03:33:47 +0000","<a href=""https://about.twitter.com/products/tweetdeck"" rel=""nofollow"">TweetDeck</a>","It my latest book, you’ll learn to build game isometric perspective view. 
http://t.co/V3vf5nCfVn http://t.co/qt6txO8gKR","","","","http://www.packtpub.com/html5-game-development-hotshot/book,http://twitter.com/makzan/status/480554214683205633/photo/1"
"480528543982424064","","","2014-06-22 01:51:47 +0000","<a href=""http://twitter.com/download/iphone"" rel=""nofollow"">Twitter for iPhone</a>","It was web design course yesterday. Then we have adobe training today. At the same time finalizing my upcoming book. Wonderful weekend.","","","",""
"480293072895356928","","","2014-06-21 10:16:06 +0000","<a href=""http://twitter.com/download/iphone"" rel=""nofollow"">Twitter for iPhone</a>","Bought the beats mixr black.","","","",""
"480233774090051584","","","2014-06-21 06:20:28 +0000","<a href=""http://www.tumblr.com/"" rel=""nofollow"">Tumblr</a>","Photo: Hello friends. My selfie. http://t.co/30Km6ewztW","","","","http://tmblr.co/ZBkANy1JIfXpf"
"480000639997468673","","","2014-06-20 14:54:05 +0000","<a href=""https://about.twitter.com/products/tweetdeck"" rel=""nofollow"">TweetDeck</a>","An article on introducing CSS, for my web design course. http://t.co/xbttqOdOQR","","","","http://makzan.net/introducing-web-design/chapter-3/"
"479190035418599425","","","2014-06-18 09:13:02 +0000","<a href=""http://www.talenthouse.com"" rel=""nofollow"">Talenthouse App</a>","I just voted for Hoi Ngar Chan at https://t.co/X3reY3geZc on @talenthouse #NowFeeling","","","","https://www.talenthouse.com/i/194/submission/121255/8e4738eb"
"478509115493580800","","","2014-06-16 12:07:18 +0000","<a href=""http://www.tumblr.com/"" rel=""nofollow"">Tumblr</a>","Photo: Stellanova, Korean edition. http://t.co/6kGXiwM2Xv","","","","http://tmblr.co/ZBkANy1IrwLxl"
"478399234698653696","","","2014-06-16 04:50:40 +0000","<a href=""http://www.tumblr.com/"" rel=""nofollow"">Tumblr</a>","Photo: Very nice cultural experience at Inchon airport, Seoul. http://t.co/uzEF7IrlUZ","","","","http://tmblr.co/ZBkANy1IqcUCC"
"478389701141733376","","","2014-06-16 04:12:47 +0000","<a href=""http://twitter.com/download/iphone"" rel=""nofollow"">Twitter for iPhone</a>","At Inchon Airport waiting for boarding. Can't wait to get back and work on the CreateJS tutorials.","","","",""
"478156122164318209","","","2014-06-15 12:44:37 +0000","<a href=""http://www.tumblr.com/"" rel=""nofollow"">Tumblr</a>","Photo: Time for the chicken and beer. http://t.co/epRGOtRUoc","","","","http://tmblr.co/ZBkANy1IlzfDP"
"478076800304955392","","","2014-06-15 07:29:26 +0000","<a href=""http://www.tumblr.com/"" rel=""nofollow"">Tumblr</a>","Photo: 造訪都敏俊的家。 http://t.co/RiqcsEIS7S","","","","http://tmblr.co/ZBkANy1Il7ZoE"
"477722623275958272","","","2014-06-14 08:02:03 +0000","<a href=""http://www.tumblr.com/"" rel=""nofollow"">Tumblr</a>","Photo: I love to buy books everywhere, though I can’t read Korean at all. http://t.co/s4IOhvqSrQ","","","","http://tmblr.co/ZBkANy1Ifbyxd"
"477612555247288320","","","2014-06-14 00:44:41 +0000","<a href=""http://twitter.com/download/iphone"" rel=""nofollow"">Twitter for iPhone</a>","Day 3 in Seoul. There are doodles everywhere. http://t.co/5Qcu5Njp9B","","","","http://twitter.com/makzan/status/477612555247288320/photo/1"
"477470631156412416","","","2014-06-13 15:20:44 +0000","<a href=""http://www.apple.com"" rel=""nofollow"">iOS</a>","A quick drawing at a café in Seoul. http://t.co/tEQtUJdRDJ","","","","http://twitter.com/makzan/status/477470631156412416/photo/1"
"477425456174485505","","","2014-06-13 12:21:13 +0000","<a href=""http://twitter.com/download/iphone"" rel=""nofollow"">Twitter for iPhone</a>","In Seoul. This is a city of shopping day &amp; night. Restaurants and markets open 24. http://t.co/qrS2xzYCZs","","","","http://twitter.com/makzan/status/477425456174485505/photo/1"
"477326924570583043","","","2014-06-13 05:49:41 +0000","<a href=""http://twitter.com/download/iphone"" rel=""nofollow"">Twitter for iPhone</a>","RT @SwiftLang: ""Using Swift with Cocoa (and Cocoa Touch) and Objective-C"" is now in the iBooks Store, too. https://t.co/qyd695vv5D","477304989891567616","2526229286","2014-06-13 04:22:32 +0000","https://itunes.apple.com/us/book/using-swift-cocoa-objective/id888894773?mt=11,https://itunes.apple.com/us/book/using-swift-cocoa-objective/id888894773?mt=11"
"477326275892088832","","","2014-06-13 05:47:07 +0000","<a href=""http://www.tumblr.com/"" rel=""nofollow"">Tumblr</a>","Photo: Café at aA Design Museum. http://t.co/8Rhk6TVd8n","","","","http://tmblr.co/ZBkANy1IZd_Sd"
"477043821445120001","","","2014-06-12 11:04:44 +0000","<a href=""http://www.tumblr.com/"" rel=""nofollow"">Tumblr</a>","Photo: Selfie. http://t.co/XffuZIlZJ6","","","","http://tmblr.co/ZBkANy1IUkk5x"
"476868770271883264","","","2014-06-11 23:29:09 +0000","<a href=""http://www.tumblr.com/"" rel=""nofollow"">Tumblr</a>","Video: Nice animation on the information kiosk in Inchon airport. http://t.co/EsGYLIjS92","","","","http://tmblr.co/ZBkANy1IS4989"
"476762433634455553","","","2014-06-11 16:26:36 +0000","<a href=""http://www.tumblr.com/"" rel=""nofollow"">Tumblr</a>","Photo: 澳門機場的凌晨，全都是飛往南韓的旅客。 http://t.co/OXa7dZkEqO","","","","http://tmblr.co/ZBkANy1IPzuuA"
"476331046280372224","","","2014-06-10 11:52:25 +0000","<a href=""http://www.tumblr.com/"" rel=""nofollow"">Tumblr</a>","Photo: Big meal for Father’s Day. http://t.co/SZXA7g8WUD","","","","http://tmblr.co/ZBkANy1IJ64u8"
"476304679110844417","476251380672249856","365188717","2014-06-10 10:07:39 +0000","<a href=""http://twitter.com"" rel=""nofollow"">Twitter Web Client</a>","@BumbleBritches5 @craig_apple This is fake account. https://t.co/IbfLyVOYNg","","","","https://twitter.com/CNBCSocial/status/474978958229118976"
"475998879947575296","","","2014-06-09 13:52:31 +0000","<a href=""https://about.twitter.com/products/tweetdeck"" rel=""nofollow"">TweetDeck</a>","Super excited. Here is the cover of my book – HTML5 game dev hotshot. http://t.co/oASQ3KpOT2","","","","http://twitter.com/makzan/status/475998879947575296/photo/1"
"475878778149670912","","","2014-06-09 05:55:16 +0000","<a href=""https://about.twitter.com/products/tweetdeck"" rel=""nofollow"">TweetDeck</a>","If you have bought my HTML5 game dev video, you may check my update on the example code for EaselJS v0.7 https://t.co/XYyoz69HZJ","","","","https://github.com/makzan/HTML5-Games-Examples/commit/4ed86ae488d35768f587e15ab88d54c4f8ea1135#diff-e66009a6bf882230db314efc477d7c3d"
"475869609937993729","","","2014-06-09 05:18:50 +0000","<a href=""https://about.twitter.com/products/tweetdeck"" rel=""nofollow"">TweetDeck</a>","Planning the South Korea trip. 3 days to go.","","","",""
"475611067066748929","","","2014-06-08 12:11:29 +0000","<a href=""http://twitter.com/download/iphone"" rel=""nofollow"">Twitter for iPhone</a>","RT @rauchg: OSX Yosemite is now scriptable with JavaScript!
Release notes: https://t.co/Y9TDhanIA7 http://t.co/j5Z4NJOzVs","475360408849489921","15540222","2014-06-07 19:35:27 +0000","https://developer.apple.com/library/prerelease/mac/releasenotes/InterapplicationCommunication/RN-JavaScriptForAutomation/index.html#//apple_ref/doc/uid/TP40014508,http://twitter.com/rauchg/status/475360408849489921/photo/1,https://developer.apple.com/library/prerelease/mac/releasenotes/InterapplicationCommunication/RN-JavaScriptForAutomation/index.html#//apple_ref/doc/uid/TP40014508,http://twitter.com/rauchg/status/475360408849489921/photo/1"
"475282817803231232","","","2014-06-07 14:27:08 +0000","<a href=""http://twitter.com/download/iphone"" rel=""nofollow"">Twitter for iPhone</a>","My book is in final edit now. Ultra excited. 8 games in a book. http://t.co/V3vf5nCfVn","","","","http://www.packtpub.com/html5-game-development-hotshot/book"
"473690991702986755","","","2014-06-03 05:01:47 +0000","<a href=""https://about.twitter.com/products/tweetdeck"" rel=""nofollow"">TweetDeck</a>","RT @sunsf: Apple implements what Android can do but implements it right.","473681565491277824","17357412","2014-06-03 04:24:20 +0000",""
"473687035782238209","","","2014-06-03 04:46:04 +0000","<a href=""https://about.twitter.com/products/tweetdeck"" rel=""nofollow"">TweetDeck</a>","So here is my next book topic: Making iOS games with SpriteKit and Swift Playground. Coming this fall.","","","",""
"473527186599591936","","","2014-06-02 18:10:53 +0000","<a href=""http://tapbots.com/tweetbot"" rel=""nofollow"">Tweetbot for iΟS</a>","iCloud drive seems to be the first time iOS gets an official file system to end user.","","","",""
"473525104068939776","","","2014-06-02 18:02:37 +0000","<a href=""http://tapbots.com/tweetbot"" rel=""nofollow"">Tweetbot for iΟS</a>","The new OSX and iOS features are so obvious that seems should have been existed. Welcome to the modern mobile age finally. I love them!","","","",""
"472726225040179200","","","2014-05-31 13:08:09 +0000","<a href=""http://www.tumblr.com/"" rel=""nofollow"">Tumblr</a>","Photo: 是夜正宗葡國餐，燒乳豬。 http://t.co/bIwhDzLokb","","","","http://tmblr.co/ZBkANy1HOpVfU"
"472298776523440128","","","2014-05-30 08:49:37 +0000","<a href=""http://www.tumblr.com/"" rel=""nofollow"">Tumblr</a>","Photo: 3X3 http://t.co/n1RaqCrd1H","","","","http://tmblr.co/ZBkANy1HIY1gj"
"472064195505037312","","","2014-05-29 17:17:29 +0000","<a href=""http://twitter.com/download/iphone"" rel=""nofollow"">Twitter for iPhone</a>","Time to sleep. Another busy day tomorrow.","","","",""
"472064119500050432","","","2014-05-29 17:17:11 +0000","<a href=""http://twitter.com/download/iphone"" rel=""nofollow"">Twitter for iPhone</a>","On the final stage to make the book polish. Learn dev HTML5 game with 8 game projects. CSS3, canvas, CreateJS and physics.","","","",""
"471546652520890368","","","2014-05-28 07:00:57 +0000","<a href=""http://www.tumblr.com/"" rel=""nofollow"">Tumblr</a>","Photo: Painter. http://t.co/0qJRhopWuc","","","","http://tmblr.co/ZBkANy1H6Y1QL"
"471324768449593344","","","2014-05-27 16:19:16 +0000","<a href=""http://www.tumblr.com/"" rel=""nofollow"">Tumblr</a>","Photo: My favorite example in my upcoming HTML5 game dev book.... http://t.co/2ILgB7xzzs","","","","http://tmblr.co/ZBkANy1H2CNOT"
"471156146921672704","","","2014-05-27 05:09:13 +0000","<a href=""https://about.twitter.com/products/tweetdeck"" rel=""nofollow"">TweetDeck</a>","I truly hate MS Office for Mac. It sucks.","","","",""
"470919406827356160","","","2014-05-26 13:28:30 +0000","<a href=""http://www.tumblr.com/"" rel=""nofollow"">Tumblr</a>","Photo: The color of wallpaper matches the phone perfectly. http://t.co/GhzfnhLZha","","","","http://tmblr.co/ZBkANy1GxE-Qt"
"470794362776215552","","","2014-05-26 05:11:37 +0000","<a href=""http://www.tumblr.com/"" rel=""nofollow"">Tumblr</a>","Photo: Current setup in office. http://t.co/tyBYr4Cqva","","","","http://tmblr.co/ZBkANy1GvoZ6L"
"470552342933557248","","","2014-05-25 13:09:55 +0000","<a href=""http://www.tumblr.com/"" rel=""nofollow"">Tumblr</a>","Photo: 感謝叮叮甜到上心口既週年禮物，送上愛叮畫一幅。 http://t.co/74jiXAvBSq","","","","http://tmblr.co/ZBkANy1Gq-_EF"
