"tweet_id","in_reply_to_status_id","in_reply_to_user_id","timestamp","source","text","retweeted_status_id","retweeted_status_user_id","retweeted_status_timestamp","expanded_urls"
"10708513915","","","2010-03-19 00:00:00 +0000","<a href=""http://twitter.com"" rel=""nofollow"">Twitter Web Client</a>","Flash Tips: Using Webcam in Flash - The following class will use the Camera class in Flash and try to take a... http://tumblr.com/xdx7ktk4w","","","",""
"10708894461","","","2010-03-19 00:00:00 +0000","<a href=""http://twitter.com"" rel=""nofollow"">Twitter Web Client</a>","Flash Tips: Singleton Pattern Class - The following class is a demonstration of the singleton pattern.... http://tumblr.com/xdx7ku0pw","","","",""
"10724413907","","","2010-03-19 00:00:00 +0000","<a href=""http://twitter.com"" rel=""nofollow"">Twitter Web Client</a>","Overheard: A fun conversation with ALICE chat bot - me : Hi ALICE: Hi there! me : Who are you? ALICE: My name... http://tumblr.com/xpz7l7ezq","","","",""
"10645973247","","","2010-03-18 00:00:00 +0000","<a href=""http://twitter.com"" rel=""nofollow"">Twitter Web Client</a>","Tile Based Games Tutorial - This is an old but very useful tutorial for making Tile Based Flash Games. The... http://tumblr.com/xdx7j5a29","","","",""
"10653317823","","","2010-03-18 00:00:00 +0000","<a href=""http://twitter.com"" rel=""nofollow"">Twitter Web Client</a>","Flash Tips: Drawing From Mouse Snippet - This is a code snippet for drawing lines in flash by mouse. It is... http://tumblr.com/xdx7jdymq","","","",""
"10653561690","","","2010-03-18 00:00:00 +0000","<a href=""http://twitter.com"" rel=""nofollow"">Twitter Web Client</a>","Photo: This photo is took by my golden half film camera. The place is the bus station outside my home. http://tumblr.com/xpz7je80s","","","",""
"10657160776","","","2010-03-18 00:00:00 +0000","<a href=""http://twitter.com"" rel=""nofollow"">Twitter Web Client</a>","I'm addict to tumblr. now.","","","",""
"10657518021","","","2010-03-18 00:00:00 +0000","<a href=""http://twitter.com"" rel=""nofollow"">Twitter Web Client</a>","Flash Tips: Debugging with Flash Console - Flash Console is a debugger that embed into your flash swf. It is... http://tumblr.com/xdx7jioag","","","",""
"10662537846","","","2010-03-18 00:00:00 +0000","<a href=""http://twitter.com"" rel=""nofollow"">Twitter Web Client</a>","Photo: My Slides. All took by my Nikon F50 film camera. http://tumblr.com/xpz7jnyka","","","",""
"10672820148","","","2010-03-18 00:00:00 +0000","<a href=""http://twitter.com"" rel=""nofollow"">Twitter Web Client</a>","Dream Weaver - I am a dream weaver that has been chasing my dream since I was 8. After 16 years, I make quite... http://tumblr.com/xpz7jw8tm","","","",""
"10681138063","","","2010-03-18 00:00:00 +0000","<a href=""http://twitter.com"" rel=""nofollow"">Twitter Web Client</a>","Flash Tips: Integer Random Number - This is a short function to generate integer random number within a... http://tumblr.com/xdx7k241v","","","",""
"10595791845","","","2010-03-17 00:00:00 +0000","<a href=""http://twitter.com"" rel=""nofollow"">Twitter Web Client</a>","Flash Tips: Bring Movieclip to Front - In ActionScript 3, all children’s z-order must be in sequence. That is... http://tumblr.com/xdx7huzq8","","","",""
"10596889163","","","2010-03-17 00:00:00 +0000","<a href=""http://twitter.com"" rel=""nofollow"">Twitter Web Client</a>","Photo: There is a get-thing-done technique that. Use this pomodoro. It is to set the timer from 25 minites... http://tumblr.com/xpz7hw3he","","","",""
"10599884155","","","2010-03-17 00:00:00 +0000","<a href=""http://twitter.com"" rel=""nofollow"">Twitter Web Client</a>","Auto-generate getter / setter of ActionScript 3 in TextMate - Using get set accessor to access instance... http://tumblr.com/xdx7hz5l3","","","",""
"10602403093","","","2010-03-17 00:00:00 +0000","<a href=""http://twitter.com"" rel=""nofollow"">Twitter Web Client</a>","Photo: This is the temple outside my home. It is a special things that churches and temples are at everywhere... http://tumblr.com/xpz7i1nij","","","",""
"10608137060","","","2010-03-17 00:00:00 +0000","<a href=""http://twitter.com"" rel=""nofollow"">Twitter Web Client</a>","Flash Tips: The API change of Trace - The API of Trace changed when upgrading from AS2 to AS3. In AS2, the... http://tumblr.com/xdx7i825e","","","",""
"10608329315","","","2010-03-17 00:00:00 +0000","<a href=""http://twitter.com"" rel=""nofollow"">Twitter Web Client</a>","It is very tired and I can’t think of anything during sick. I just want to sleep. http://tumblr.com/xpz7i8a8x","","","",""
"10615894120","","","2010-03-17 00:00:00 +0000","<a href=""http://twitter.com"" rel=""nofollow"">Twitter Web Client</a>","Introducing Flash Tips at tumblr. - tumblr. is a micro-blogging place that suitable to publish code snippets... http://tumblr.com/xpz7ifeud","","","",""
"10622739687","","","2010-03-17 00:00:00 +0000","<a href=""http://twitter.com"" rel=""nofollow"">Twitter Web Client</a>","Why Flash Tips? - You may ask why I start this micro-blog flash tips project to talk about those AS3 and AS2... http://tumblr.com/xdx7iknzt","","","",""
"10623260268","","","2010-03-17 00:00:00 +0000","<a href=""http://twitter.com"" rel=""nofollow"">Twitter Web Client</a>","""The secret to building half a product instead of a half-ass product is saying NO."" - 37signals http://tumblr.com/xpz7il1e7","","","",""
"10562974665","","","2010-03-16 00:00:00 +0000","<a href=""http://twitter.com"" rel=""nofollow"">Twitter Web Client</a>","What am I doing? - Well, I am going to submit the draft of the “Non-player characters” by the end of this... http://tumblr.com/xpz7h33jr","","","",""
"10563028491","","","2010-03-16 00:00:00 +0000","<a href=""http://twitter.com"" rel=""nofollow"">Twitter Web Client</a>","""It’s better to make half a product than a half-assed product."" - 37signals http://tumblr.com/xpz7h35cr","","","",""
"10563131644","","","2010-03-16 00:00:00 +0000","<a href=""http://twitter.com"" rel=""nofollow"">Twitter Web Client</a>","Photo: Photos with Carol, my friend in CUHK http://tumblr.com/xpz7h3911","","","",""
"10563730812","","","2010-03-16 00:00:00 +0000","<a href=""http://twitter.com"" rel=""nofollow"">Twitter Web Client</a>","Photo: Running out of HDD Space http://tumblr.com/xpz7h3sbp","","","",""
"10563806296","","","2010-03-16 00:00:00 +0000","<a href=""http://twitter.com"" rel=""nofollow"">Twitter Web Client</a>","trying Tumblr. http://makzan.tumblr.com/","","","",""
"10564149160","10564112176","117437180","2010-03-16 00:00:00 +0000","<a href=""http://twitter.com"" rel=""nofollow"">Twitter Web Client</a>","@fbindie Thanks a lot :)","","","",""
"10565452048","","","2010-03-16 00:00:00 +0000","<a href=""http://twitter.com"" rel=""nofollow"">Twitter Web Client</a>","Hungry - When you are getting sick with flu, you feel very hungry all the time and need to eat a lot of foods... http://tumblr.com/xpz7h594k","","","",""
"10573432550","","","2010-03-16 00:00:00 +0000","<a href=""http://twitter.com"" rel=""nofollow"">Twitter Web Client</a>","A typical Tumblr post - This is a testing post for publishing tumblr post from terminal by using a ruby gem... http://tumblr.com/xpz7hb69b","","","",""
"10578506418","","","2010-03-16 00:00:00 +0000","<a href=""http://twitter.com"" rel=""nofollow"">Twitter Web Client</a>","Flash Tips: Extend AS3 with Official AS3CoreLib - If you want to do md5/sha1 in ActionScript3, or dealing... http://tumblr.com/xdx7hexc6","","","",""
"10579106685","10578581022","38885874","2010-03-16 00:00:00 +0000","<a href=""http://twitter.com"" rel=""nofollow"">Twitter Web Client</a>","@FlashArtOfWar thanks for the retweet :)","","","",""
"10580183613","","","2010-03-16 00:00:00 +0000","<a href=""http://twitter.com"" rel=""nofollow"">Twitter Web Client</a>","Going to sleep and hope tomorrow I will get better from the flu.","","","",""
"10464447154","","","2010-03-14 00:00:00 +0000","<a href=""http://twitter.com"" rel=""nofollow"">Twitter Web Client</a>","yeah, photo taking all day in CUHK with my friends in Hong Kong.","","","",""
"10419899644","","","2010-03-13 00:00:00 +0000","<a href=""http://twitter.com"" rel=""nofollow"">Twitter Web Client</a>","waiting iPad to come.","","","",""
"10370195126","","","2010-03-12 00:00:00 +0000","<a href=""http://twitter.com"" rel=""nofollow"">Twitter Web Client</a>","prepare to wait the closed apple store open again and pre-order iPad.","","","",""
"10246413626","10239712514","19806012","2010-03-10 00:00:00 +0000","<a href=""http://twitter.com"" rel=""nofollow"">Twitter Web Client</a>","@Redestium The edge of the touch screen is too sensitive that when you hold it in one hand, it 'feels' your palm and fingers on edge.","","","",""
"10246490697","10239712514","19806012","2010-03-10 00:00:00 +0000","<a href=""http://twitter.com"" rel=""nofollow"">Twitter Web Client</a>","@Redestium and then it refuse to sense the real actual touch point. And it cause a problem that I often can't operate it on one hand.","","","",""
"10249507978","10247828405","19806012","2010-03-10 00:00:00 +0000","<a href=""http://twitter.com"" rel=""nofollow"">Twitter Web Client</a>","@Redestium you're welcome. If you can try it on hand in retail shop. You may try to use in it only one hand and choose. May be they've fixit","","","",""
"10199542976","","","2010-03-09 00:00:00 +0000","<a href=""http://twitter.com"" rel=""nofollow"">Twitter Web Client</a>","Tried Nexus One for 4 days. The touch screen is so bad that can't hold the phone in one hand and operate it with the thumb. ultra disappoint","","","",""
"10003368936","","","2010-03-05 00:00:00 +0000","<a href=""http://twitter.com"" rel=""nofollow"">Twitter Web Client</a>","reading: stop making it complicated http://bit.ly/cdC4tL","","","",""
"9963779371","","","2010-03-04 00:00:00 +0000","<a href=""http://twitter.com"" rel=""nofollow"">Twitter Web Client</a>","is going to attend Android Lab Hong Kong tomorrow.","","","",""
"9811730932","","","2010-03-01 00:00:00 +0000","<a href=""http://www.nibirutech.com/"" rel=""nofollow"">MobileRSS iPhone</a>","reading: Zen Habits - 4 Simple Principles of Getting to Completion http://zenhabits.net/2010/02/completion-principles/","","","",""
"9764429624","","","2010-02-28 00:00:00 +0000","<a href=""http://twitter.com"" rel=""nofollow"">Twitter Web Client</a>","is watching the documentary: ""Wild China""","","","",""
"9779523872","","","2010-02-28 00:00:00 +0000","<a href=""http://twitter.com"" rel=""nofollow"">Twitter Web Client</a>","reading book: Getting Real from 37Signals","","","",""
"9658386674","","","2010-02-26 00:00:00 +0000","<a href=""http://twitter.com"" rel=""nofollow"">Twitter Web Client</a>","RT @fbindie 9 Reasons Why Indie Devs Won't Do Facebook http://post.ly/PYmb","","","",""
"9609007445","","","2010-02-25 00:00:00 +0000","<a href=""http://twitter.com"" rel=""nofollow"">Twitter Web Client</a>","I finally get the book ""Getting Real"" print copy. After receiving the first print defect book and requesting re-order. It arrived at last.","","","",""
"9630731131","","","2010-02-25 00:00:00 +0000","<a href=""http://twitter.com"" rel=""nofollow"">Twitter Web Client</a>","I feel really happy when reading book every day. Especially those books for simple life and less coding.","","","",""
"9631707411","","","2010-02-25 00:00:00 +0000","<a href=""http://twitter.com"" rel=""nofollow"">Twitter Web Client</a>","RT @fbindie: Where are all the Facebook Indie Game Developers? http://post.ly/PY16","9630283224","117437180","2010-02-25 15:32:31 +0000",""
"9519146349","","","2010-02-23 00:00:00 +0000","<a href=""http://twitter.com"" rel=""nofollow"">Twitter Web Client</a>","reading: How I Was Able to Ace Exams Without Studying  http://bit.ly/aRLp6L","","","",""
"9525372467","","","2010-02-23 00:00:00 +0000","<a href=""http://twitter.com"" rel=""nofollow"">Twitter Web Client</a>","watching: Differences between German and Chinese. Interesting. http://www.youtube.com/watch?v=Kc50NUInsi0&feature=related","","","",""
"9469970337","","","2010-02-22 00:00:00 +0000","<a href=""http://twitter.com"" rel=""nofollow"">Twitter Web Client</a>","Trying if I can play the survival project korea version in Hong Kong","","","",""
"9326239670","","","2010-02-19 00:00:00 +0000","<a href=""http://twitter.com"" rel=""nofollow"">Twitter Web Client</a>","My workspace in Hong Kong. http://www.flickr.com/photos/makzan/4368970109/","","","",""
"9345655482","","","2010-02-19 00:00:00 +0000","<a href=""http://twitter.com"" rel=""nofollow"">Twitter Web Client</a>","I really like the Spirited Away for Mac. It keeps my desktop clean with only the working window automatically.","","","",""
"9347009216","","","2010-02-19 00:00:00 +0000","<a href=""http://twitter.com"" rel=""nofollow"">Twitter Web Client</a>","bought Fundamentals of Game Design book today. After making dozen of games, it is good to review the most basic things and refresh my mind.","","","",""
"9262794228","","","2010-02-18 00:00:00 +0000","<a href=""http://twitter.com"" rel=""nofollow"">Twitter Web Client</a>","thinking to plant some grass inside my home.","","","",""
"9214483649","9114767888","22825722","2010-02-17 00:00:00 +0000","<a href=""http://twitter.com"" rel=""nofollow"">Twitter Web Client</a>","@garyh357 Thank you very much.","","","",""
"9214552354","","","2010-02-17 00:00:00 +0000","<a href=""http://twitter.com"" rel=""nofollow"">Twitter Web Client</a>","back to my working town from Chinese new year vacation.","","","",""
"9226666199","","","2010-02-17 00:00:00 +0000","<a href=""http://twitter.com"" rel=""nofollow"">Twitter Web Client</a>","using Spirited Away for Mac, a little app that auto hide inactive windows, say 60 seconds. Keep working window non-distract.","","","",""
"9236891940","","","2010-02-17 00:00:00 +0000","<a href=""http://twitter.com"" rel=""nofollow"">Twitter Web Client</a>","Just got a email from me 4 yrs ago via futureme.org. It is really cool to receive an email from my past and I just sent another to my future","","","",""
"9125097850","","","2010-02-15 00:00:00 +0000","<a href=""http://twitter.com"" rel=""nofollow"">Twitter Web Client</a>","I dream of Steve Jobs last night. He was presenting in an internal lecture talking about the latest technology from Apple.","","","",""
"9083832175","","","2010-02-14 00:00:00 +0000","<a href=""http://twitter.com"" rel=""nofollow"">Twitter Web Client</a>","Happy Chinese New Year!! Wishing all have a healthy body and earn more in the ""year of Tiger"".","","","",""
"8953540767","","","2010-02-12 00:00:00 +0000","<a href=""http://twitter.com"" rel=""nofollow"">Twitter Web Client</a>","The future technology will be about sharing. The sharing of all people's knowledge and the way to present it.","","","",""
"8991466030","","","2010-02-12 00:00:00 +0000","<a href=""http://twitter.com"" rel=""nofollow"">Twitter Web Client</a>","going back to my home town, Macao, for the Chinese New Year. In Chinese, we must go home and have a dinner with the whole family these days.","","","",""
"8991984179","8991668408","32863089","2010-02-12 00:00:00 +0000","<a href=""http://twitter.com"" rel=""nofollow"">Twitter Web Client</a>","@bennytin You're now in US, right? Happy New Year Tin.","","","",""
"8992787618","8992427748","32863089","2010-02-12 00:00:00 +0000","<a href=""http://twitter.com"" rel=""nofollow"">Twitter Web Client</a>","@bennytin Thanks a lot ^^","","","",""
"8882076840","","","2010-02-10 00:00:00 +0000","<a href=""http://twitter.com"" rel=""nofollow"">Twitter Web Client</a>","What is Google Buzz!? Is it the social tool from Google?","","","",""
"8889918688","","","2010-02-10 00:00:00 +0000","<a href=""http://twitter.com"" rel=""nofollow"">Twitter Web Client</a>","just write a shell script for creating empty web design project. It setups the saas, haml, php, jquery environment in one command line call","","","",""
"8849087533","","","2010-02-09 00:00:00 +0000","<a href=""http://twitter.com"" rel=""nofollow"">Twitter Web Client</a>","just found the online Regular Expression community from gskinner. http://www.gskinner.com/RegExr/","","","",""
"8663386354","","","2010-02-05 00:00:00 +0000","<a href=""http://twitter.com"" rel=""nofollow"">Twitter Web Client</a>","Just see the new Facebook UI.","","","",""
"8629006246","","","2010-02-04 00:00:00 +0000","<a href=""http://twitter.com"" rel=""nofollow"">Twitter Web Client</a>","Today sketch post: Sleepless Night. http://makzan.me/mini/2010/02/04/sleepless-night/","","","",""
"8488593158","","","2010-02-01 00:00:00 +0000","<a href=""http://twitter.com"" rel=""nofollow"">Twitter Web Client</a>","is going to buy Ricoh CX2 tomorrow.","","","",""
"8502046669","","","2010-02-01 00:00:00 +0000","<a href=""http://twitter.com"" rel=""nofollow"">Twitter Web Client</a>","blog post: Auto generate getter setter of ActionScript 3 in TextMate http://bit.ly/9dHC4n","","","",""
"8459674787","","","2010-01-31 00:00:00 +0000","<a href=""http://twitter.com"" rel=""nofollow"">Twitter Web Client</a>","My safari is horribly unstable. All I can do is say bye to Safari and use Chrome for Mac instead.","","","",""
"8421081053","","","2010-01-30 00:00:00 +0000","<a href=""http://twitter.com"" rel=""nofollow"">Twitter Web Client</a>","reading: Web developers can rule the iPad http://bit.ly/bkx9OB","","","",""
"8349808961","","","2010-01-29 00:00:00 +0000","<a href=""http://twitter.com"" rel=""nofollow"">Twitter Web Client</a>","RT @chingshen: The iPad provides the ultimate browsing experience? http://theflashblog.com/?p=1703","","","",""
"8360226524","","","2010-01-29 00:00:00 +0000","<a href=""http://twitter.com"" rel=""nofollow"">Twitter Web Client</a>","just bought Typinator for EURO19.9. I have to say, really type less done more. http://www.typinator.com/","","","",""
"8319199011","","","2010-01-28 00:00:00 +0000","<a href=""http://twitter.com"" rel=""nofollow"">Twitter Web Client</a>","reading: How to Leave Your Readers Better Than You Found Them http://bit.ly/cOXJI8","","","",""
"8320662983","","","2010-01-28 00:00:00 +0000","<a href=""http://twitter.com"" rel=""nofollow"">Twitter Web Client</a>","These days, I am thinking how my future career will be and what is my role in the whole industry. I've got some idea but still confusing.","","","",""
"8322292009","8322166706","21362524","2010-01-28 00:00:00 +0000","<a href=""http://twitter.com"" rel=""nofollow"">Twitter Web Client</a>","@siurekrek Thanks a lot :)","","","",""
"8270869399","","","2010-01-27 00:00:00 +0000","<a href=""http://twitter.com"" rel=""nofollow"">Twitter Web Client</a>","is buying 280 Atlas beta.","","","",""
"8290016800","","","2010-01-27 00:00:00 +0000","<a href=""http://twitter.com"" rel=""nofollow"">Twitter Web Client</a>","with the new iPad, we have to rethink how an application should work and interactive with the user well.","","","",""
"8290206220","8290102173","21629274","2010-01-27 00:00:00 +0000","<a href=""http://twitter.com"" rel=""nofollow"">Twitter Web Client</a>","@hungjai 又真係有得接project wor!?!","","","",""
"8290244383","","","2010-01-27 00:00:00 +0000","<a href=""http://twitter.com"" rel=""nofollow"">Twitter Web Client</a>","too exited to wrongly used chinese in my english twitter account :(","","","",""
"8293989884","","","2010-01-27 00:00:00 +0000","<a href=""http://twitter.com"" rel=""nofollow"">Twitter Web Client</a>","installing SDK 3.2.2","","","",""
"8231611055","","","2010-01-26 00:00:00 +0000","<a href=""http://twitter.com"" rel=""nofollow"">Twitter Web Client</a>","playing Cappuccino, A Cocoa-like Javascript framework. http://cappuccino.org/","","","",""
"8194611068","","","2010-01-25 00:00:00 +0000","<a href=""http://twitter.com"" rel=""nofollow"">Twitter Web Client</a>","new blog post: Sunset Time-lapse, A competition between Sunset and iPhone battery. http://makzan.me/blog/sunset-time-lapse/","","","",""
"8200244747","","","2010-01-25 00:00:00 +0000","<a href=""http://twitter.com"" rel=""nofollow"">Twitter Web Client</a>","just found this: Windows 3.1 in html/css/js. http://www.michaelv.org/","","","",""
"8075802943","","","2010-01-22 00:00:00 +0000","<a href=""http://twitter.com"" rel=""nofollow"">Twitter Web Client</a>","bought the Joby GorillaMobile for iPhone in Hong Kong.","","","",""
"8077107802","","","2010-01-22 00:00:00 +0000","<a href=""http://twitter.com"" rel=""nofollow"">Twitter Web Client</a>","RT @elijahmanor: ""YouTube and Vimeo turn on HTML5 video tag"" by @Ajaxian #tech #webdev http://j.mp/7QFGfO","","","",""
"8006830918","","","2010-01-21 00:00:00 +0000","<a href=""http://twitter.com"" rel=""nofollow"">Twitter Web Client</a>","Using Sleep Cycle for iPhone in first night. It really works well.","","","",""
"8037424101","","","2010-01-21 00:00:00 +0000","<a href=""http://twitter.com"" rel=""nofollow"">Twitter Web Client</a>","my first time-lapse video from iPhone: from day to night, outside my house. 
http://vimeo.com/8891157","","","",""
"7980675492","","","2010-01-20 00:00:00 +0000","<a href=""http://twitter.com"" rel=""nofollow"">Twitter Web Client</a>","reading: Sleeping Enough is More Important Than Early-Rising  http://bit.ly/6FB8n6","","","",""
"7991234090","","","2010-01-20 00:00:00 +0000","<a href=""http://twitter.com"" rel=""nofollow"">Twitter Web Client</a>","start a time lapse project today that take one photo of myself every day using Photo Booth and cron job.","","","",""
"7938511142","","","2010-01-19 00:00:00 +0000","<a href=""http://twitter.com"" rel=""nofollow"">Twitter Web Client</a>","get exited to know that SproutCore is now 1.0 beta.","","","",""
"7897939357","","","2010-01-18 00:00:00 +0000","<a href=""http://twitter.com"" rel=""nofollow"">Twitter Web Client</a>","Real-time Web Collaborating Possibility http://makzan.me/blog/real-time-web-collaborating-possibility/","","","",""
"7867736619","","","2010-01-17 00:00:00 +0000","<a href=""http://twitter.com"" rel=""nofollow"">Twitter Web Client</a>","RT @kovshenin: 20 Fresh #JavaScript Data Visualization Libraries http://bit.ly/8fcF4K #webdesign","","","",""
"7830616614","","","2010-01-16 00:00:00 +0000","<a href=""http://twitter.com"" rel=""nofollow"">Twitter Web Client</a>","Emerging Techniques Every Web Developer Should Know from Woork http://mrwda.com/9202/","","","",""
"7832359403","","","2010-01-16 00:00:00 +0000","<a href=""http://twitter.com"" rel=""nofollow"">Twitter Web Client</a>","add a twitter background to my plain white theme.","","","",""
"7773715497","","","2010-01-15 00:00:00 +0000","<a href=""http://twitter.com"" rel=""nofollow"">Twitter Web Client</a>","RT @letscounthedays Strategizing Web Content - Writing for the Web | letscounthedays http://ow.ly/1mY70S","","","",""
"7775539436","","","2010-01-15 00:00:00 +0000","<a href=""http://twitter.com"" rel=""nofollow"">Twitter Web Client</a>","is getting a little bit confuse on the future.","","","",""
"7777248288","","","2010-01-15 00:00:00 +0000","<a href=""http://twitter.com"" rel=""nofollow"">Twitter Web Client</a>","reading: When In Doubt, Go Simple: 5 Reasons Simple Design Works http://bit.ly/7TWfLQ","","","",""
"7669762124","","","2010-01-12 00:00:00 +0000","<a href=""http://twitter.com"" rel=""nofollow"">Twitter Web Client</a>","just found a sounds good debugger for Flash.","","","",""
"7627501053","","","2010-01-11 00:00:00 +0000","<a href=""http://twitter.com"" rel=""nofollow"">Twitter Web Client</a>","reading: Breakdown of Great Web App Homepage Design http://inspectelement.com/articles/web-application-homepage-analysis/","","","",""
"7629931713","","","2010-01-11 00:00:00 +0000","<a href=""http://twitter.com"" rel=""nofollow"">Twitter Web Client</a>","reading: The 20 Best Productivity and Personal Development Blogs http://bit.ly/6Wa9gb","","","",""
"7547336801","","","2010-01-09 00:00:00 +0000","<a href=""http://twitter.com"" rel=""nofollow"">Twitter Web Client</a>","Google Chrome for Mac supports extensions now. It's almost time to migrate from safari to chrome.","","","",""
"7549087903","","","2010-01-09 00:00:00 +0000","<a href=""http://twitter.com"" rel=""nofollow"">Twitter Web Client</a>","sick at home :(","","","",""
"7502467449","7490046012","15529557","2010-01-08 00:00:00 +0000","<a href=""http://twitter.com"" rel=""nofollow"">Twitter Web Client</a>","@tomeglenn Hi Tom, I got a month free for my {gs} plan. Thank you very much. Now I'm running both {gs} and {dv} plan in media temple.","","","",""
"7502985067","","","2010-01-08 00:00:00 +0000","<a href=""http://twitter.com"" rel=""nofollow"">Twitter Web Client</a>","It is really hard to get up earlier in winter. The bed is just too warm in the morning.","","","",""
"7512023379","","","2010-01-08 00:00:00 +0000","<a href=""http://twitter.com"" rel=""nofollow"">Twitter Web Client</a>","getting sick...... :(","","","",""
"7474327428","","","2010-01-07 00:00:00 +0000","<a href=""http://twitter.com"" rel=""nofollow"">Twitter Web Client</a>","recently I'm thinking on how a whole team can collaborate together working one a project, even without meeting each other face by face.","","","",""
"7426200512","","","2010-01-06 00:00:00 +0000","<a href=""http://twitter.com"" rel=""nofollow"">Twitter Web Client</a>","reading: Build a Better Drop Shadow, from About.com http://desktoppub.about.com/od/creategraphics/ss/dropshadows_3.htm","","","",""
"7389456521","","","2010-01-05 00:00:00 +0000","<a href=""http://twitter.com"" rel=""nofollow"">Twitter Web Client</a>","has a life of reading, writing and coding","","","",""
"7389557152","","","2010-01-05 00:00:00 +0000","<a href=""http://twitter.com"" rel=""nofollow"">Twitter Web Client</a>","reading: Decade In Web Design. http://www.problogdesign.com/design/decade-in-web-design/","","","",""
